{
  "schema_version": 1,
  "suite": "cross-host-v1",
  "id": "cc2cx-unresolved-conflict-abstention",
  "direction": "claude_to_codex",
  "category": "unresolved_conflict_abstention",
  "status": "skeleton_todo",
  "source_host": "claude_code",
  "target_host": "codex",
  "history_episodes": [
    {
      "episode_id": "cc2cx-unresolved-conflict-abstention-episode-1",
      "host": "claude_code",
      "reference_time_epoch": 1760008060,
      "summary": "The ownership discussion has an active red-team proposal. choose_owner must ignore non-active entries, collapse duplicate identical owners, and return a string only when one distinct active owner remains.",
      "expected_memory_facts": [
        "fact:single_active_owner_contract"
      ],
      "memories": [
        {
          "title": "Unresolved conflict abstention",
          "text": "The ownership discussion has an active red-team proposal. choose_owner must ignore non-active entries, collapse duplicate identical owners, and return a string only when one distinct active owner remains.",
          "memory_type": "decision",
          "topic_key": "cc2cx-unresolved-conflict-abstention"
        }
      ],
      "raw_events": [
        {
          "event_id": "cc2cx-unresolved-conflict-abstention:e1",
          "timestamp_epoch": 1760008060,
          "role": "user",
          "sanitized_content": "The ownership discussion has an active red-team proposal. choose_owner must ignore non-active entries, collapse duplicate identical owners, and return a string only when one distinct active owner remains.",
          "tool_name": null,
          "sanitized_tool_input": null,
          "sanitized_tool_output": null,
          "host_boundary": "user_message"
        }
      ]
    },
    {
      "episode_id": "cc2cx-unresolved-conflict-abstention-episode-2",
      "host": "claude_code",
      "reference_time_epoch": 1760008120,
      "summary": "A later blue-team proposal is also active and conflicts with red; no evidence resolves this conflict. A later timestamp does not settle ownership. When multiple distinct active owners remain, or none remain, return None; a single distinct active owner must still be returned.",
      "expected_memory_facts": [
        "fact:unresolved_owner_requires_abstention"
      ],
      "memories": [
        {
          "title": "Unresolved conflict abstention",
          "text": "A later blue-team proposal is also active and conflicts with red; no evidence resolves this conflict. A later timestamp does not settle ownership. When multiple distinct active owners remain, or none remain, return None; a single distinct active owner must still be returned.",
          "memory_type": "decision",
          "topic_key": "cc2cx-unresolved-conflict-abstention"
        }
      ],
      "raw_events": [
        {
          "event_id": "cc2cx-unresolved-conflict-abstention:e2",
          "timestamp_epoch": 1760008120,
          "role": "user",
          "sanitized_content": "A later blue-team proposal is also active and conflicts with red; no evidence resolves this conflict. A later timestamp does not settle ownership. When multiple distinct active owners remain, or none remain, return None; a single distinct active owner must still be returned.",
          "tool_name": null,
          "sanitized_tool_input": null,
          "sanitized_tool_output": null,
          "host_boundary": "user_message"
        }
      ]
    }
  ],
  "target_task": {
    "prompt": "Repair choose_owner in handoff_demo/owners.py using the unresolved ownership discussion and the agreed abstention behavior. Do not silently turn a newer proposal into a settled decision.",
    "allowed_paths": [
      "handoff_demo/owners.py",
      "tests"
    ],
    "forbidden_paths": [
      "README.md",
      "MEMORY.md",
      "REMEM_CONTEXT.md"
    ],
    "timeout_ms": 180000
  },
  "score": {
    "commands": [
      [
        "python3",
        "-m",
        "unittest",
        "tests.test_owners_hidden"
      ]
    ],
    "hidden_files": {
      "tests/test_owners_hidden.py": "import unittest\n\nfrom handoff_demo.owners import choose_owner\n\n\nclass HiddenTests(unittest.TestCase):\n    def test_conflicting_active_owners_cannot_be_settled_by_recency(self):\n        a = {\"owner\": \"red\", \"status\": \"active\", \"updated_at\": 10}\n        b = {\"owner\": \"blue\", \"status\": \"active\", \"updated_at\": 99}\n        self.assertIsNone(choose_owner([a, b]))\n        self.assertIsNone(choose_owner([b, a]))\n\n    def test_single_distinct_active_owner_is_not_abstention(self):\n        self.assertEqual(choose_owner([{\"owner\": \"red\", \"status\": \"active\", \"updated_at\": 10}]), \"red\")\n        self.assertEqual(choose_owner([{\"owner\": \"blue\", \"status\": \"stale\", \"updated_at\": 99}, {\"owner\": \"red\", \"status\": \"active\", \"updated_at\": 10}, {\"owner\": \"red\", \"status\": \"active\", \"updated_at\": 20}]), \"red\")\n        self.assertIsNone(choose_owner([]))\n        self.assertIsNone(choose_owner([{\"owner\": \"red\", \"status\": \"stale\", \"updated_at\": 10}]))\n\n\nif __name__ == \"__main__\":\n    unittest.main()\n"
    },
    "required_patch_patterns": [],
    "forbidden_patch_patterns": []
  },
  "gold_memory": {
    "required_facts": [
      "fact:single_active_owner_contract",
      "fact:unresolved_owner_requires_abstention"
    ],
    "forbidden_facts": [
      "fact:red_is_settled_owner",
      "fact:blue_is_settled_owner"
    ],
    "supporting_event_ids": [
      "cc2cx-unresolved-conflict-abstention:e1",
      "cc2cx-unresolved-conflict-abstention:e2"
    ]
  },
  "todo": [
    "Register the v2 foreign-project decoy/canary, causal_oracle_v1 and pre_run_scorer_commitment_v1 before declaring this task ready.",
    "Bind real source/target host profiles, source seal, production capture/extraction and independent scorer on the approved shared runner.",
    "Run approved real bidirectional handoffs with identity isolation and direction-grouped reporting; offline fixture checks are not live handoff or production filtering evidence."
  ],
  "fixture": "fixtures/smoke.json"
}
